{
  "$schema": "http://json-schema.org/draft-07/schema#",
  "title": "Challenge",
  "type": "object",
  "required": ["slug", "title", "category", "difficulty", "description_md", "content_version"],
  "properties": {
    "slug": { "type": "string", "pattern": "^[a-z0-9-]+$" },
    "title": { "type": "string" },
    "category": { "type": "string", "description": "Must match a category slug." },
    "difficulty": { "type": "string", "enum": ["beginner", "intermediate", "hard"] },
    "description_md": { "type": "string" },
    "requires_network": { "type": "boolean", "default": false },
    "requires_systemd": { "type": "boolean", "default": false },
    "resource_limits": {
      "type": "object",
      "properties": {
        "memoryMb": { "type": "integer", "minimum": 32 },
        "cpus": { "type": "number", "minimum": 0.1 },
        "pidsLimit": { "type": "integer", "minimum": 10 }
      }
    },
    "tmpfs": {
      "type": "object",
      "description": "Map of mount path -> tmpfs options (e.g. \"size=16m\"). Mounted rw in the challenge container; used for size-bounded, fillable filesystems (disk-full scenarios) since host bind-mounts are disallowed.",
      "additionalProperties": { "type": "string" }
    },
    "time_limit_minutes": { "type": "integer", "minimum": 1 },
    "content_version": { "type": "integer", "minimum": 1 }
  }
}
